,Unnamed: 0,id,title,type,description,release_year,age_certification,runtime,genres,production_countries,seasons,imdb_id,imdb_score,imdb_votes,tmdb_popularity,tmdb_score,prop_female
1537,3219,tm548602,Between Two Ferns: The Movie,MOVIE,"Galifianakis dreamed of becoming a star. But when Will Ferrell discovered his public access TV show, 'Between Two Ferns' and uploaded it to Funny or Die, Zach became a viral laughing stock. Now Zach and his crew are taking a road trip to complete a series of high-profile celebrity interviews and restore his reputation.",2019,,82,['comedy'],['US'],,tt9398640,6.1,32036.0,12.486,6.0,0.2692307692307692
1541,3223,tm332071,Velvet Buzzsaw,MOVIE,"Big money artists and mega-collectors pay a high price when art collides with commerce. After a series of paintings by an unknown artist are discovered, a supernatural force enacts revenge on those who have allowed their greed to get in the way of art.",2019,R,113,"['thriller', 'horror', 'comedy']",['US'],,tt7043012,5.7,60629.0,16.079,5.3,0.38636363636363635
1543,3226,ts86908,L.A.'s Finest,SHOW,"Syd Burnett has left her complicated past behind to become an LAPD detective. Paired with a new partner, Nancy McKenna, a working mom with an equally complex past, Syd is pushed to examine whether her unapologetic lifestyle might be masking a greater personal secret. These two women don't agree on much, but they find common ground when it comes to taking on the most dangerous criminals in Los Angeles.",2019,TV-14,47,"['crime', 'drama', 'action', 'comedy', 'thriller']",['US'],2.0,tt7555294,6.1,7000.0,21.788,7.3,0.375
1546,3232,tm428557,The Laundromat,MOVIE,"When her idyllic vacation takes an unthinkable turn, Ellen Martin begins investigating a fake insurance policy, only to find herself down a rabbit hole of questionable dealings that can be linked to a Panama City law firm and its vested interest in helping the world's wealthiest citizens amass larger fortunes.",2019,R,96,"['drama', 'history', 'comedy', 'crime']",['US'],,tt5868244,6.3,49391.0,10.319,6.0,0.30158730158730157
1555,3246,tm455568,Paddleton,MOVIE,An unlikely friendship between two neighbors becomes an unexpectedly emotional journey when the younger man is diagnosed with terminal cancer.,2019,R,89,"['drama', 'comedy']",['US'],,tt8041276,7.1,13791.0,7.338999999999999,7.0,0.4090909090909091
1560,3255,ts215691,Teenage Bounty Hunters,SHOW,"After joining forces with a veteran bounty hunter, sixteen-year-old fraternal twin sisters Sterling and Blair dive into the world of bail skipping baddies while still navigating the high stakes of teenage love and sex.",2020,TV-MA,49,"['comedy', 'drama', 'action', 'crime']",['US'],1.0,tt10584608,7.6,11426.0,16.492,7.9,0.25
1564,3261,ts288350,Julie and the Phantoms,SHOW,Teenage Julie finds her passion for music and life while helping the Phantoms -- a trio of ghostly guys -- become the band they were never able to be.,2020,TV-G,2,"['scifi', 'fantasy', 'music', 'comedy', 'drama', 'family', 'documentation']",['US'],1.0,tt14337216,8.4,9725.0,13.925999999999998,8.584,0.4
1566,3266,tm498803,Spenser Confidential,MOVIE,"When two Boston police officers are murdered, ex-cop Spenser teams up with his no-nonsense roommate Hawk to take down criminals.",2020,R,111,"['action', 'comedy', 'drama', 'thriller', 'crime']",['US'],,tt8629748,6.2,86593.0,21.502,6.545,0.2987012987012987
1570,3276,ts84993,Daybreak,SHOW,"Living his best life in post-apocalyptic LA, a slacker strives to find the girl of his dreams while outwitting mindless ghouls and cliquish gangs.",2019,TV-MA,47,"['scifi', 'drama', 'fantasy', 'horror', 'action', 'comedy', 'thriller']",['US'],1.0,tt12374132,6.6,19654.0,18.304,7.3,0.45454545454545453
1572,3279,tm877681,American Pie Presents: Girls' Rules,MOVIE,"It's Senior year at East Great Falls. Annie, Kayla, Michelle, and Stephanie decide to harness their girl power and band together to get what they want their last year of high school.",2020,R,95,['comedy'],['US'],,tt11771594,,,50.358,6.3,0.4583333333333333
1575,3282,ts269690,Schulz Saves America,SHOW,Comedian Andrew Schulz takes on the year's most divisive topics in this fearlessly unfiltered and irreverent four-part special.,2020,TV-MA,17,['comedy'],['US'],1.0,tt13607518,7.3,1086.0,1.4,7.3,0.5
1583,3291,tm824477,Over the Moon,MOVIE,"In this animated musical, a girl builds a rocket ship and blasts off, hoping to meet a mythical moon goddess.",2020,PG,95,"['comedy', 'family', 'fantasy', 'scifi', 'romance', 'animation']","['CN', 'US']",,tt7488208,6.3,22034.0,75.251,7.3,0.4
1588,3297,tm925486,Jiu Jitsu,MOVIE,"Every six years, an ancient order of jiu-jitsu fighters joins forces to battle a vicious race of alien invaders. But when a celebrated war hero goes down in defeat, the fate of the planet and mankind hangs in the balance.",2020,R,102,"['action', 'scifi', 'fantasy', 'thriller', 'comedy']","['US', 'CY']",,tt9624766,2.9,8693.0,96.709,5.0,0.4117647058823529
1590,3306,tm420455,Rim of the World,MOVIE,"Stranded at a summer camp when aliens attack the planet, four teens with nothing in common embark on a perilous mission to save the world.",2019,PG,99,"['scifi', 'action', 'comedy']",['US'],,tt8179388,5.2,23987.0,22.933000000000003,6.0,0.0
1591,3307,ts236747,Middleditch & Schwartz,SHOW,Comedy duo Thomas Middleditch and Ben Schwartz turn small ideas into epically funny stories in this series of completely improvised comedy specials.,2020,TV-MA,51,['comedy'],['US'],1.0,tt12027034,8.6,5310.0,2.329,8.0,0.0
1594,3310,ts90019,Bonding,SHOW,A New York City grad student moonlighting as a dominatrix enlists her gay BFF from high school to be her assistant.,2019,TV-MA,17,"['drama', 'comedy']",['US'],2.0,tt7718088,7.1,16027.0,19.49,7.4,0.3333333333333333
1596,3312,tm348403,A Shaun the Sheep Movie: Farmageddon,MOVIE,"When an alien with amazing powers crash-lands near Mossy Bottom Farm, Shaun the Sheep goes on a mission to shepherd the intergalactic visitor home before a sinister organization can capture her.",2019,G,87,"['family', 'comedy', 'animation', 'fantasy', 'scifi']","['GB', 'FR']",,tt6193408,6.8,13485.0,16.792,6.93,0.29411764705882354
1603,3323,tm974366,We Can Be Heroes,MOVIE,"When alien invaders capture Earth's superheroes, their kids must learn to work together to save their parents - and the planet.",2020,PG,97,"['fantasy', 'drama', 'family', 'action', 'comedy']",['US'],,tt10600398,4.7,14759.0,72.986,6.2,0.37209302325581395
1607,3327,ts105542,The Baker and the Beauty,SHOW,A blue-collar baker strikes up a relationship with an international superstar. US version of the Israeli romantic comedy series 'The Baker and the Beauty'.,2020,TV-14,32,"['comedy', 'drama', 'romance']",['US'],1.0,tt9164986,7.3,4270.0,8.545,8.1,0.5
1610,3332,ts88721,Special,SHOW,A gay man with mild cerebral palsy decides to rewrite his identity as an accident victim and finally go after the life he wants.,2019,TV-MA,22,"['comedy', 'drama']",['US'],2.0,tt9381622,7.6,9434.0,6.88,6.7,0.3333333333333333
1614,3339,tm822246,The Forty-Year-Old Version,MOVIE,"Radha is a down-on-her-luck NY playwright, who is desperate for a breakthrough before 40. Reinventing herself as rapper RadhaMUSPrime, she vacillates between the worlds of Hip Hop and theater in order to find her true voice.",2020,R,123,"['comedy', 'drama', 'music']",['US'],,tt10642834,7.2,5003.0,11.646,6.9,0.35714285714285715
1626,3354,tm852996,Captain Underpants: Epic Choice-o-rama,MOVIE,"In this interactive special, Harold and George need your decision-making skills to stop Krupp from blowing their beloved treehouse to smithereens.",2020,,37,"['comedy', 'fantasy', 'family', 'animation', 'action', 'scifi']",['US'],,tt11604750,6.4,80.0,4.5,8.0,0.25
1627,3356,tm464557,The Perfect Date,MOVIE,"No beau? No problem! To earn money for college, a high schooler creates a dating app that lets him act as a stand-in boyfriend.",2019,PG-13,93,"['romance', 'comedy']",['US'],,tt8201170,5.8,38796.0,51.174,6.5,0.45454545454545453
1628,3359,tm554944,Love Wedding Repeat,MOVIE,"While trying to make his sister's wedding day go smoothly, Jack finds himself juggling an angry ex-girlfriend, an uninvited guest with a secret, a misplaced sleep sedative, and the girl who got away in alternate versions of the same day.",2020,,100,"['comedy', 'romance']","['GB', 'IT']",,tt5096470,5.5,20412.0,10.708,5.66,0.35
1634,3365,tm918706,The Sleepover,MOVIE,"Two siblings who discover their seemingly normal mom is a former thief in witness protection. Mom is forced to pull one last job, and the kids team up to rescue her over the course of an action-packed night.",2020,,103,"['action', 'comedy', 'family']",['US'],,tt10888708,5.6,10399.0,9.88,6.5,0.41935483870967744
1635,3366,tm910040,Milkwater,MOVIE,"Seeking direction and purpose, Milo rashly decides to become a surrogate and egg donor for an older gay man she meets in a bar. However, as Milo becomes increasingly attached to him, she starts leveraging the pregnancy as a means of staying embedded in his life.",2020,,102,"['comedy', 'drama']",['US'],,,,,1.692,4.3,0.3333333333333333
1637,3369,ts271247,LEGO City Adventures,SHOW,"Welcome to LEGO City, a modern metropolis filled with the fiercest firefighters, the cream of the crop cops, and so many Blockheads. Every citizen will assemble together for the most awesomely awesome adventures.",2019,TV-Y7,13,"['animation', 'action', 'comedy', 'family']",['US'],4.0,tt10332322,6.7,194.0,7.24,7.4,0.5
1638,3370,ts255926,Dash & Lily,SHOW,"A whirlwind holiday romance builds as cynical Dash and optimistic Lily trade dares, dreams, and desires in the notebook they pass back and forth at locations all across New York City.",2020,TV-14,25,"['drama', 'comedy', 'romance']",['US'],1.0,tt1758589,7.5,16978.0,16.738,8.2,0.5
1639,3371,tm827216,Bill Burr: Paper Tiger,MOVIE,"Comedian Bill Burr talks male feminists, outrage culture, robot sex, and cultural appropriation in this standup comedy special shot in London.",2019,,67,['comedy'],"['GB', 'US']",,tt10847306,8.1,10979.0,6.16,7.3,0.0
1644,3381,tm827142,Dave Chappelle: Sticks & Stones,MOVIE,"Dave Chappelle takes on gun culture, the opioid crisis and the tidal wave of celebrity scandals in this defiant stand-up special.",2019,R,65,['comedy'],['US'],,tt10810424,8.4,26075.0,7.885,7.646,0.5
1647,3386,ts251157,Wizards: Tales of Arcadia,SHOW,"Merlin’s apprentice joins Arcadia’s heroes on a time-bending adventure in Camelot, where conflict is brewing between the human, troll and magical worlds.",2020,TV-Y7,24,"['action', 'comedy', 'scifi', 'animation']",['US'],1.0,,,,27.027,8.302999999999999,0.3076923076923077
1649,3391,tm490222,Uncorked,MOVIE,Elijah must balance his dream of becoming a master sommelier with his father's expectations that he carry on the family's Memphis BBQ joint.,2020,,104,"['drama', 'comedy']",['US'],,tt9261218,6.4,5588.0,8.757,6.1,0.3870967741935484
1650,3392,tm467579,The Last Summer,MOVIE,"Standing on the precipice of adulthood, a group of friends navigate new relationships, while reexamining others, during their final summer before college.",2019,,109,"['romance', 'comedy']",['US'],,,,,20.86,6.0,0.38461538461538464
1653,3397,tm452826,Poms,MOVIE,A woman moves into a retirement community and starts a cheerleading squad with her fellow residents.,2019,PG-13,91,"['comedy', 'drama', 'sport']","['GB', 'US']",,tt5125894,6.0,6274.0,9.696,6.6,0.42857142857142855
1657,3405,tm475783,Jo Koy: Comin’ In Hot,MOVIE,"Comedian Jo Koy takes center stage in Hawaii and shares his honest take on island life, ethnicity, fatherhood and more.",2019,,60,['comedy'],['US'],,tt10377036,7.3,1049.0,2.53,7.1,0.0
1660,3410,ts88485,Green Eggs and Ham,SHOW,"Guy-Am-I, an inventor, and his friend Sam-I-Am go on a cross-country trip that would test the limits of their friendship. As they learn to try new things, they find out what adventure brings.",2019,TV-Y7,28,"['animation', 'comedy', 'action', 'family', 'drama', 'fantasy', 'romance']",['US'],2.0,tt4651448,8.1,2631.0,13.878,8.6,0.375
1662,3413,tm849005,The Willoughbys,MOVIE,"When the four Willoughby children are abandoned by their selfish parents, they must learn how to adapt their Old-Fashioned values to the contemporary world in order to create something new: The Modern Family.",2020,PG,92,"['comedy', 'fantasy', 'animation', 'drama', 'family']",['CA'],,tt5206260,6.3,18662.0,22.543000000000006,7.1,0.47058823529411764
1665,3416,ts218500,Dragons: Rescue Riders,SHOW,Twins Dak and Leyla share a unique ability to communicate with dragons. The brother and sister lead a team of five young dragons that spend their days rescuing other dragons and helping the people in their adopted town of Huttsgalor.,2019,TV-Y,24,"['action', 'comedy', 'family', 'fantasy', 'animation', 'scifi']",['US'],2.0,tt10687134,5.9,314.0,10.237,7.0,0.42857142857142855
1668,3421,ts251420,Hoops,SHOW,A foul-mouthed high school basketball coach is sure he'll hit the big leagues if he can only turn his terrible team around. Good luck with that.,2020,,26,"['comedy', 'animation']",['US'],1.0,,,,7.627000000000002,7.226,0.16666666666666666
1669,3423,tm465231,Nate Bargatze: The Tennessee Kid,MOVIE,"Comic Nate Bargatze touches on air travel, cheap weddings, college football, chocolate milk and the perils of ordering coffee in this stand-up special.",2019,,60,['comedy'],['US'],,tt9861504,7.6,1835.0,2.5780000000000003,7.5,0.5
1670,3424,tm922788,The Babysitter: Killer Queen,MOVIE,"Two years after defeating a satanic cult led by his babysitter Bee, Cole's trying to forget his past and focus on surviving high school. But when old enemies unexpectedly return, Cole will once again have to outsmart the forces of evil.",2020,R,101,"['comedy', 'horror']",['US'],,tt11024272,5.8,38684.0,83.92399999999998,6.4,0.43902439024390244
1671,3426,ts89881,Mr. Iglesias,SHOW,Hilarious high school teacher Gabriel Iglesias tries to make a difference in the lives of some smart but underperforming students at his alma mater.,2019,TV-14,29,['comedy'],['US'],3.0,tt8403536,7.1,6857.0,7.974,7.7,0.4444444444444444
1673,3430,tm827501,Tall Girl,MOVIE,"Jodi, the tallest girl in her high school, has always felt uncomfortable in her own skin. But after years of slouching, being made fun of, and avoiding attention at all costs, Jodi finally decides to find the confidence to stand tall.",2019,PG,101,"['comedy', 'drama', 'romance', 'family']",['US'],,tt9252508,5.2,23452.0,25.358,6.4,0.46875
1674,3432,ts251067,The Baby-Sitters Club,SHOW,"In this contemporary take on the beloved book series, five best friends launch a baby-sitting business that's big on fun and adventure.",2020,TV-G,27,"['comedy', 'drama', 'family']",['US'],2.0,tt8690518,7.3,3966.0,29.598000000000006,8.0,0.42857142857142855
1676,3435,ts214861,Prank Encounters,SHOW,takes two complete strangers who each think they're starting their first day at a new job. It's business as usual until their paths collide and these part-time jobs turn into full-time nightmares.,2019,TV-MA,23,"['reality', 'comedy', 'horror', 'scifi']",['US'],2.0,tt10487072,5.2,2728.0,15.251,7.3,0.0
1677,3436,tm120072,Let It Snow,MOVIE,"In a small town on Christmas Eve, a snowstorm brings together a group of young people. They soon find their friendships and love lives colliding, and come Christmas morning, nothing will be the same.",2019,PG-13,93,"['romance', 'comedy']",['US'],,tt1950235,5.8,21828.0,14.599,6.101,0.3333333333333333
1678,3437,ts93054,Trinkets,SHOW,An unexpected friendship forms when three teenage girls meet in Shoplifters Anonymous.,2019,TV-MA,26,"['drama', 'comedy', 'crime']",['US'],2.0,tt9134194,7.0,10725.0,17.648,8.089,0.3333333333333333
1679,3438,tm936396,Holidate,MOVIE,"Fed up with being single on holidays, two strangers agree to be each other's platonic plus-ones all year long, only to catch real feelings along the way.",2020,,104,"['romance', 'comedy']",['US'],,tt9866072,6.1,63070.0,13.344,7.1,0.4358974358974359
1683,3443,ts87986,Dolly Parton's Heartstrings,SHOW,"Eight stories celebrating family, faith, love and forgiveness come to life in this series inspired by Dolly Parton's iconic country music catalog.",2019,TV-14,66,"['drama', 'music', 'comedy']",['US'],1.0,tt8509922,7.6,2107.0,4.747,7.3,0.0
1684,3444,ts252098,The Duchess,SHOW,"Katherine's a single mom juggling her career, her tween daughter, her relationship with her boyfriend — and pondering getting pregnant with her ex.",2020,TV-MA,24,"['comedy', 'drama']",['GB'],1.0,,,,5.557,7.1,0.4
1686,3449,tm885775,Unbreakable Kimmy Schmidt: Kimmy vs. the Reverend,MOVIE,Kimmy's a famous author and she's about to marry a prince! But first she has to foil the Reverend's evil plot. It's your move: What should Kimmy do next?,2020,PG-13,80,"['comedy', 'scifi', 'romance']",['US'],,tt10324166,6.9,5376.0,8.317,6.4,0.375
1687,3450,ts100359,Medical Police,SHOW,"Two American physicians in São Paulo, Brazil, discover a civilization-threatening virus and are recruited as government agents in a race against time and around the world to find a cure and uncover a dark conspiracy.",2020,TV-MA,24,['comedy'],['US'],1.0,tt9850952,5.9,4203.0,9.85,6.7,0.5
1688,3453,ts93482,The Last Kids on Earth,SHOW,"Young teenager Jack Sullivan and a group of friends live in a decked-out tree house, playing video games, eating candy, and fighting zombies in the aftermath of a monster apocalypse.",2019,,35,"['animation', 'comedy', 'family', 'horror', 'scifi']",['US'],4.0,tt8914012,7.2,1358.0,13.206,8.4,0.4444444444444444
1689,3454,tm835486,Jenny Slate: Stage Fright,MOVIE,Jenny Slate's debut stand up-comedy special blends with home videos from her childhood and interviews of her with her family.,2019,,66,"['comedy', 'reality']",['US'],,tt10971520,5.8,1291.0,3.462,5.9,0.5
1690,3458,tm511940,Lying and Stealing,MOVIE,"Ivan steals art for the Greek. He wants out but can he? He meets an actress at two of his ""jobs"". She has her own problems but helps him.",2019,R,100,"['crime', 'drama', 'comedy']",['US'],,tt7558302,5.4,5818.0,20.588,6.0,0.3
1694,3464,ts190462,Gentefied,SHOW,The Morales cousins scramble to save their grandfather's taco shop--and pursue their own dreams--as gentrification shakes up their LA neighborhood.,2020,TV-MA,30,"['comedy', 'drama']",['US'],2.0,tt10037034,7.3,2697.0,3.205,7.8,0.25
1695,3465,tm459512,To All the Boys: P.S. I Still Love You,MOVIE,Lara Jean and Peter have just taken their romance from pretend to officially real when another recipient of one of her love letters enters the picture.,2020,PG-13,102,"['romance', 'comedy', 'drama']",['US'],,tt9354842,6.0,37471.0,38.468,6.898,0.4727272727272727
1696,3468,tm847998,Hubie Halloween,MOVIE,"Hubie Dubois, despite his devotion to his hometown of Salem, Massachusetts (and its legendary Halloween celebration), is a figure of mockery for kids and adults alike. But this year, something really is going bump in the night, and it’s up to Hubie to save Halloween.",2020,PG-13,103,"['horror', 'comedy', 'thriller', 'fantasy']",['US'],,tt10682266,5.2,48575.0,18.454,6.0,0.4457831325301205
1697,3470,tm931686,Vampires vs. the Bronx,MOVIE,Three gutsy kids from a rapidly gentrifying Bronx neighborhood stumble upon a sinister plot to suck all the life from their beloved community.,2020,PG-13,86,"['comedy', 'horror']",['US'],,tt8976576,5.6,9815.0,11.147,5.9,0.40625
1699,3474,tm467299,Anthony Jeselnik: Fire in the Maternity Ward,MOVIE,"Forging his own comedic boundaries, Anthony Jeselnik revels in getting away with saying things others can't in this stand-up special shot in New York.",2019,,64,['comedy'],['US'],,tt10050780,7.2,3605.0,4.2780000000000005,7.0,0.5
1700,3476,ts86413,AJ and the Queen,SHOW,"While traveling across the country in a run-down RV, drag queen Ruby Red discovers an unlikely sidekick in AJ: a tough-talking 10-year-old stowaway.",2020,TV-14,51,"['comedy', 'drama']",['US'],1.0,tt8404094,7.4,8129.0,10.486,7.7,0.5
1701,3479,ts275111,Rainbow High,SHOW,7 girls at Rainbow High must face challenges and learn to flaunt their true colors.,2020,TV-Y,6,"['comedy', 'family', 'animation']",['US'],3.0,tt13488080,5.8,141.0,2.632,9.8,0.0
1702,3480,ts87008,Turn Up Charlie,SHOW,A down-and-out DJ plots to rebuild his music career while working as a nanny for his famous best friend's wild 11-year-old daughter.,2019,TV-MA,27,"['comedy', 'drama', 'music']",['GB'],1.0,tt8304498,7.0,7431.0,5.235,7.2,0.2
1703,3481,tm855600,The Stand In,MOVIE,"When ordered to serve a year in rehab, actress Candy hires her on-set stand-in to take her place. The unassuming woman flips the script and steals her identity, career and boyfriend in this hilarious comedy about trading places.",2020,R,97,"['comedy', 'drama']",['US'],,tt7970348,4.7,3439.0,7.135,5.6,0.4864864864864865
1705,3483,tm824165,Falling Inn Love,MOVIE,"When city girl Gabriela spontaneously enters a contest and wins a rustic New Zealand inn, she teams up with bighearted contractor Jake Taylor to fix and flip it.",2019,,98,"['romance', 'comedy']",['US'],,tt9860752,5.6,19559.0,19.061,6.529,0.4444444444444444
1708,3486,ts254045,Sneakerheads,SHOW,Family man Devin falls back into his sneaker obsession after his pal Bobby talks him into a wheeling-dealing scheme to score a mythical pair of kicks.,2020,,30,['comedy'],['US'],1.0,,,,8.927,7.5,0.2857142857142857
1711,3492,tm855483,Have a Good Trip: Adventures in Psychedelics,MOVIE,"Celebrities recall their most mind-bending trips via animations, reenactments and more in this comedic documentary exploring the story of psychedelics.",2020,,85,"['documentation', 'comedy']",['US'],,tt12133722,6.8,7707.0,12.231,6.9,0.2857142857142857
1712,3496,tm475836,The Lonely Island Presents: The Unauthorized Bash Brothers Experience,MOVIE,The Lonely Island spoofs Jose Canseco and Mark McGwire in this visual rap album set in the Bash Brothers' 1980s heyday.,2019,,30,"['comedy', 'music']",['US'],,tt10376068,,,6.171,6.2,0.3333333333333333
1713,3497,tm524282,Invader ZIM: Enter the Florpus,MOVIE,"ZIM discovers his almighty leaders never had any intention of coming to Earth and he loses confidence in himself for the first time in his life, which is the big break his human nemesis, Dib has been waiting for.",2019,,71,"['drama', 'animation', 'action', 'family', 'fantasy', 'comedy', 'scifi', 'thriller', 'horror']",['US'],,tt6739816,7.4,5796.0,10.288,7.6,0.3157894736842105
1716,3503,tm469008,How High 2,MOVIE,"When two jobless friends discover a hidden weed bible and the ultimate bud, they think that they’ve got it made…with 'seed' money to start a new snack delivery app. But, when nearly all of their stash and weed bible are stolen, the two potpreneurs set off on an outrageous, mind-bending adventure through Atlanta to find them. Stoned with supernatural powers, they search 'high' and low, stopping at nothing to recover their ticket to starting a legit business.",2019,,89,['comedy'],['US'],,tt8861802,3.0,1123.0,17.294,6.6,0.4
1721,3513,ts251617,Connected,SHOW,"Science journalist Latif Nasser investigates the surprising and intricate ways in which we are connected to each other, the world and the universe.",2020,TV-14,44,"['documentation', 'comedy']",['US'],1.0,tt12753692,7.5,1724.0,4.812,8.2,0.0
1723,3521,ts84129,No Good Nick,SHOW,"A family finds their lives turned upside down when a young, street-smart grifter shows up on their doorstep, claiming to be a distant relative.",2019,TV-PG,29,"['comedy', 'family', 'drama']",['US'],2.0,tt9039142,5.9,2920.0,11.386,7.1,0.4
1729,3528,tm450478,Under the Eiffel Tower,MOVIE,"Stuart is a having a mid-life crisis. Desperate for something more in life, he tags along on his best friend's family vacation to Paris - then proposes to his friend's 24-year-old daughter, Rosalind, while standing under the Eiffel Tower.",2019,,87,"['romance', 'comedy']",['US'],,tt6251390,5.4,1031.0,4.634,5.9,0.2727272727272727
1730,3529,ts89583,Trailer Park Boys: The Animated Series,SHOW,"Nova Scotia’s favorite miscreants have always been super sketchy. Now, carrying on from the Season 12 finale, the boys have become complete cartoons.",2019,TV-MA,25,"['animation', 'comedy']",['CA'],2.0,tt9814900,7.5,2983.0,12.449000000000002,7.3,0.0
1731,3531,tm826563,A Cinderella Story: Christmas Wish,MOVIE,"Kat is an aspiring singer-songwriter who dreams of making it big. However, her dreams are stalled by her reality: a conniving and cruel stepfamily  and a demoralizing job working as a singing elf at billionaire Terrence Wintergarden’s Santa Land.",2019,PG,93,"['music', 'romance', 'fantasy', 'comedy']",['US'],,tt10326928,5.3,,22.154,6.4,0.4666666666666667
1732,3532,tm500565,Friendsgiving,MOVIE,"Molly and Abbey, along with their crew of close friends and acquaintances, host a dysfunctional, comical and chaotic Thanksgiving dinner.",2020,R,95,"['comedy', 'drama']",['US'],,tt8431078,4.4,2875.0,6.4460000000000015,4.6,0.5
1733,3533,tm887369,Jerry Seinfeld: 23 Hours to Kill,MOVIE,"Jerry Seinfeld takes the stage in New York and tackles talking vs. texting, bad buffets vs. so-called ""great"" restaurants and the magic of Pop Tarts.",2020,,60,['comedy'],['US'],,tt12117854,6.7,5128.0,4.296,6.2,0.5
1734,3534,tm844642,Michelle Wolf: Joke Show,MOVIE,"Comedian Michelle Wolf takes on outrage culture, massages, childbirth, feminism and much more (like otters) in a stand-up special from New York City.",2019,,59,['comedy'],['US'],,tt11269704,7.2,1621.0,3.234,6.8,0.0
1735,3535,tm981451,Death to 2020,MOVIE,"2020: A year so [insert adjective of choice here], even the creators of Black Mirror couldn't make it up… but that doesn't mean they don't have a little something to add. This comedy event that tells the story of the dreadful year that was — and perhaps still is? The documentary-style special weaves together some of the world's most (fictitious) renowned voices with real-life archival footage.",2020,,71,['comedy'],"['GB', 'US']",,tt13567480,6.8,38522.0,10.954,6.6,0.47619047619047616
