,Unnamed: 0,id,title,type,description,release_year,age_certification,runtime,genres,production_countries,seasons,imdb_id,imdb_score,imdb_votes,tmdb_popularity,tmdb_score,prop_female
2,3,tm127384,Monty Python and the Holy Grail,MOVIE,"King Arthur, accompanied by his squire, recruits his Knights of the Round Table, including Sir Bedevere the Wise, Sir Lancelot the Brave, Sir Robin the Not-Quite-So-Brave-As-Sir-Lancelot and Sir Galahad the Pure. On the way, Arthur battles the Black Knight who, despite having had all his limbs chopped off, insists he can still fight. They reach Camelot, but Arthur decides not  to enter, as ""it is a silly place"".",1975,PG,91,"['fantasy', 'action', 'comedy']",['GB'],,tt0071853,8.2,534486.0,15.461,7.811,0.4791666666666667
4,5,ts22164,Monty Python's Flying Circus,SHOW,"A British sketch comedy series with the shows being composed of surreality, risqué or innuendo-laden humour, sight gags and observational sketches without punchlines.",1969,TV-14,30,"['comedy', 'european']",['GB'],4.0,tt0063929,8.8,73424.0,17.617,8.306000000000001,0.0
5,6,tm70993,Life of Brian,MOVIE,"Brian Cohen is an average young Jewish man, but through a series of ridiculous events, he gains a reputation as the Messiah. When he's not dodging his followers or being scolded by his shrill mother, the hapless Brian has to contend with the pompous Pontius Pilate and acronym-obsessed members of a separatist movement. Rife with Monty Python's signature absurdity, the tale finds Brian's life paralleling Biblical lore, albeit with many more laughs.",1979,R,94,['comedy'],['GB'],,tt0079470,8.0,395024.0,17.77,7.8,0.18181818181818182
11,12,tm69997,Richard Pryor: Live in Concert,MOVIE,"Richard Pryor delivers monologues on race, sex, family and his favorite target—himself, live at the Terrace Theatre in Long Beach, California.",1979,R,78,"['comedy', 'documentation']",['US'],,tt0079807,8.1,5141.0,4.718,7.5,0.0
12,13,tm16479,White Christmas,MOVIE,Two talented song-and-dance men team up after the war to become one of the hottest acts in show business. In time they befriend and become romantically involved with the beautiful Haynes sisters who comprise a sister act.,1954,,115,"['romance', 'comedy']",['US'],,tt0047673,7.5,42488.0,8.915,7.2,0.4
13,16,tm156453,FTA,MOVIE,"A documentary about a political troupe headed by actors Jane Fonda and Donald Sutherland which traveled to towns near military bases in the US in the early 1970s. The group put on shows called ""F.T.A."", which stood for ""F**k the Army"", and was aimed at convincing soldiers to voice their opposition to the Vietnam War, which was raging at the time. Various singers, actors and other entertainers performed antiwar songs and skits during the show.",1972,R,97,"['war', 'documentation', 'music', 'comedy']",['US'],,tt0068562,6.2,418.0,1.268,6.1,0.45454545454545453
16,35,ts20681,Seinfeld,SHOW,A stand-up comedian and his three offbeat friends weather the pitfalls and payoffs of life in New York City in the '90s. It's a show about nothing.,1989,TV-PG,24,['comedy'],['US'],9.0,tt0098904,8.9,308824.0,130.213,8.301,0.25
20,39,tm138875,When Harry Met Sally...,MOVIE,"During their travel from Chicago to New York, Harry and Sally debate whether or not sex ruins a friendship between a man and a woman. Eleven years later, and they're still no closer to finding the answer.",1989,R,96,"['comedy', 'romance', 'drama']",['US'],,tt0098635,7.7,216199.0,15.123,7.4,0.40476190476190477
21,41,tm133087,Steel Magnolias,MOVIE,"A young beautician, newly arrived in a small Louisiana town, finds work at the local salon, where a small group of women share a close bond of friendship and welcome her into the fold.",1989,PG,119,"['comedy', 'drama', 'romance']",['US'],,tt0098384,7.3,54946.0,11.69,7.2,0.41304347826086957
22,42,tm177480,Police Academy,MOVIE,"New rules enforced by the Lady Mayoress mean that sex, weight, height and intelligence need no longer be a factor for joining the Police Force. This opens the floodgates for all and sundry to enter the Police Academy, much to the chagrin of the instructors. Not everyone is there through choice, though. Social misfit Mahoney has been forced to sign up as the only alternative to a jail sentence and it doesn't take long before he falls foul of the boorish Lieutenant Harris. But before long, Mahoney realises that he is enjoying being a police cadet and decides he wants to stay... while Harris decides he wants Mahoney out!",1984,R,97,"['crime', 'comedy']",['US'],,tt0087928,6.7,124881.0,25.533,6.6,0.3333333333333333
25,45,ts21715,Thomas & Friends,SHOW,"Thomas & Friends is a British children's television series, which had its first broadcast on the ITV network on 4 September 1984. It is based on The Railway Series of books by the Reverend Wilbert Awdry and his son, Christopher Awdry. These books deal with the adventures of a group of anthropomorphised locomotives and road vehicles who live on the fictional Island of Sodor. The books were based on stories Wilbert told to entertain his son, Christopher during his recovery from measles. From Series one to four, many of the stories are based on events from Awdry's personal experience.",1984,TV-Y,10,"['animation', 'family', 'comedy', 'fantasy', 'drama', 'action', 'music']",['GB'],24.0,tt0086815,6.5,5104.0,42.19600000000001,6.5,0.0
26,46,ts20678,Saved by the Bell,SHOW,"Lovable schemer Zack Morris leads his pals on adventures at California's Bayside High School. The friends navigate relationships, final exams, school dances, breakups and more while frequently frustrating their principal, Mr. Richard Belding, who does his best to keep them in check.",1989,TV-G,23,"['family', 'comedy', 'romance']",['US'],5.0,tt0096694,7.1,35034.0,19.855,8.0,0.0
28,49,tm147710,National Lampoon's Christmas Vacation,MOVIE,"It's Christmastime, and the Griswolds are preparing for a family seasonal celebration. But things never run smoothly for Clark, his wife Ellen, and their two kids. Clark's continual bad luck is worsened by his obnoxious family guests, but he manages to keep going, knowing that his Christmas bonus is due soon.",1989,PG-13,97,"['comedy', 'european']",['US'],,tt0097958,7.5,185760.0,18.862,7.2,0.45161290322580644
30,51,tm20712,Eddie Murphy Raw,MOVIE,"Eddie Murphy delights, shocks and entertains with dead-on celebrity impersonations, observations on '80s love, sex and marriage, a remembrance of Mom's hamburgers and much more.",1987,R,90,"['comedy', 'documentation']",['US'],,tt0092948,7.6,19757.0,7.992000000000001,7.3,0.47058823529411764
31,52,tm117580,She's Gotta Have It,MOVIE,"The story of Nola Darling's simultaneous sexual relationships with three different men is told by her and by her partners and other friends. All three men wanted her to commit solely to them; Nola resists being ""owned"" by a single partner.",1986,R,84,"['romance', 'comedy']",['US'],,tt0091939,6.7,14472.0,7.416,6.707000000000002,0.39285714285714285
32,53,ts23753,Major Dad,SHOW,"Major Dad is an American sitcom created by Richard C. Okie and John G. Stephens, developed by Earl Pomerantz, that originally ran from 1989 to 1993 on CBS, starring Gerald McRaney as Major John D. MacGillis and Shanna Reed as his wife Polly. The cast also includes Beverly Archer, Matt Mulhern, Jon Cypher, Marisa Ryan, Nicole Dubuc and Chelsea Hertford.",1989,TV-PG,24,"['comedy', 'family']",['US'],4.0,tt0096643,6.5,2922.0,9.849,6.5,0.375
34,55,ts987,Danger Mouse,SHOW,"Danger Mouse, the world's greatest secret agent, and his side-kick Penfold work to foil the evil schemes of Baron Greenback.",1981,TV-Y,14,"['animation', 'comedy', 'family', 'scifi', 'european']",['GB'],10.0,tt0081848,7.4,3545.0,8.55,7.5,0.0
35,59,ts2760,Fireman Sam,SHOW,"Follow the adventures of fireman Sam and his colleagues as they protect the citizens of the Welsh town of Pontypandy. Whenever the alarm sounds, brave Sam and his co-workers can be counted on to jump into a fire engine, hop onto a helicopter, or even launch an inflatable lifeboat to battle blazes, mount rescue missions, or provide medical attention to those in need.",1987,TV-Y,10,"['animation', 'comedy', 'family', 'crime', 'european']",['GB'],13.0,tt0329829,6.1,1785.0,37.647,7.2,0.0
36,60,tm21953,Sam Kinison: Breaking the Rules,MOVIE,"This is a great performance. Through yelling and energetic story-telling, he talks about marriage, drugs, being arrested (thanks to his ex-wife), pleasing women, religion, and much, much more.",1987,R,50,"['comedy', 'documentation']",['US'],,tt0307403,7.2,660.0,1.843,7.2,0.2
37,62,tm152839,Tim Allen: Men Are Pigs,MOVIE,"Comedian Tim Allen shares his enthusiasm for power tools, automobiles, grunting, and the myriad obsessions of the American male in this special for the Showtime premium cable network, which was aired a few years before he rose to stardom with the television sitcom Home Improvement.",1990,,30,"['comedy', 'documentation']",['US'],,tt0259057,6.1,360.0,2.482,6.3,0.0
38,64,tm62924,Monty Python Live at the Hollywood Bowl,MOVIE,"Monty Python perform many of their greatest sketches at the Hollywood Bowl, including several from pre-Python days.",1982,R,81,"['comedy', 'documentation']",['GB'],,tt0084352,7.9,15230.0,6.832999999999998,7.4,0.0
39,67,tm133914,Parrot Sketch Not Included: Twenty Years of Monty Python,MOVIE,"Steve Martin presents selected sketches from ""Monty Python's Flying Circus (1969)"". It's the well known sketches, though the parrot sketch is not included. Steve Martin has some funny comments on the Pythons.",1989,,72,['comedy'],['GB'],,tt0213984,8.1,1522.0,1.801,6.9,0.125
46,75,tm132164,Bill Hicks: Sane Man,MOVIE,"Sane Man was filmed before Bill recorded ‘Dangerous’, his first comedy album, and is a turning point in Hicks’ career. It was the first complete Hicks show ever filmed and Bill pulled out all the stops for the cameras. Completely focused, a newly-sober Hicks paces the stage like a wild animal riffing effortless.",1989,R,80,['comedy'],['US'],,,,,3.377,7.5,0.0
49,83,ts63001,High Risk,SHOW,"High Risk is a program aired by the CBS television network as part of its 1988 fall lineup.

The genesis of High Risk was a 1988 strike by members of both the Writers Guild of America, East and Writers Guild of America, west against the Alliance of Motion Picture and Television Producers. Unable to produce regular, scripted series, programs such as High Risk were put together to serve as replacements under fear of a two-year lockout.

The CBS 100% in-house production featured ""high-risk"" stunts and jobs such as Border Patrol agent, automobile repo men, cave explorers, and thrilling roller-coaster testers.

Intended as a two-year commitment, strike or no strike, High Risk received unanimous condemnations and was cancelled after being presented for one night. The show was hosted by Wayne Rogers.",1988,TV-PG,50,['comedy'],['US'],1.0,tt5944220,3.8,6.0,1.4,,0.0
56,98,tm25947,Snatch,MOVIE,"Unscrupulous boxing promoters, violent bookmakers, a Russian gangster, incompetent amateur robbers and supposedly Jewish jewelers fight to track down a priceless stolen diamond.",2000,R,103,"['crime', 'comedy']","['US', 'GB']",,tt0208092,8.3,841435.0,25.203000000000007,7.8,0.25
58,101,ts5145,The Challenge,SHOW,"Each Challenge pits numerous cast members from past seasons of reality shows against each other, dividing them into two separate teams according to different criteria, such as gender, which show they first appeared on, whether or not they're veterans or rookies on the show, etc. The two teams compete in numerous missions in order to win prizes and advance in the overall game.",1998,TV-14,40,"['reality', 'comedy', 'drama', 'scifi']",['US'],37.0,tt6274074,7.8,3362.0,18.075,7.7,0.0
62,106,tm113513,Dumb and Dumber,MOVIE,"Lloyd and Harry are two men whose stupidity is really indescribable. When Mary, a beautiful woman, loses an important suitcase with money before she leaves for Aspen, the two friends (who have found the suitcase) decide to return it to her. After some ""adventures"" they finally get to Aspen where, using the lost money they live it up and fight for Mary's heart.",1994,PG-13,107,['comedy'],['US'],,tt0109686,7.3,379999.0,31.852,6.6,0.35365853658536583
65,110,ts21567,Gilmore Girls,SHOW,"Set in the charming town of Stars Hollow, Connecticut, the series follows the captivating lives of Lorelai and Rory Gilmore, a mother/daughter pair who have a relationship most people only dream of.",2000,TV-14,46,"['comedy', 'drama']",['US'],8.0,tt0238784,8.2,121462.0,58.578,7.827000000000001,0.25
68,113,tm56574,You've Got Mail,MOVIE,"Book superstore magnate, Joe Fox and independent book shop owner, Kathleen Kelly fall in love in the anonymity of the Internet—both blissfully unaware that he's trying to put her out of business.",1998,PG,119,"['comedy', 'romance', 'drama']",['US'],,tt0128853,6.7,211635.0,21.724,6.643,0.5
70,115,tm53991,Big Daddy,MOVIE,"A lazy law school grad adopts a kid to impress his girlfriend, but everything doesn't go as planned and he becomes the unlikely foster father.",1999,PG-13,93,"['drama', 'comedy', 'european']",['US'],,tt0142342,6.4,215053.0,26.848000000000006,6.45,0.24
73,119,ts22193,The Magic School Bus,SHOW,An eccentric schoolteacher takes her class on wondrous educational field trips with the help of a magical school bus.,1994,TV-Y,26,"['animation', 'scifi', 'comedy', 'family', 'fantasy']","['CA', 'US']",4.0,tt0108847,7.8,9829.0,16.83,7.8,0.45454545454545453
77,124,tm187187,Last Action Hero,MOVIE,"Following the death of his father, young Danny Madigan takes comfort in watching action movies featuring the indestructible Los Angeles cop Jack Slater. After being given a magic ticket by theater manager Nick, Danny is sucked into the screen and bonds with Slater. When evil fictional villain Benedict gets his hands on the ticket and enters the real world, Danny and Jack must follow and stop him.",1993,PG-13,131,"['action', 'fantasy', 'comedy', 'family']",['US'],,tt0107362,6.4,150498.0,22.196,6.379,0.31746031746031744
78,125,ts16919,All That,SHOW,"The new kids of comedy bring the funny as All That, America’s #1 kid’s sketch comedy show, returns with a new cast and a few familiar faces. From Executive Producers Kenan Thompson and Kel Mitchell.",1994,TV-G,22,"['comedy', 'family', 'music']",['US'],11.0,tt0111875,7.5,7718.0,6.688,8.4,0.5
79,126,tm6859,My Girl,MOVIE,"Vada Sultenfuss is obsessed with death. Her mother is dead, and her father runs a funeral parlor. She is also in love with her English teacher, and joins a poetry class over the summer just to impress him. Thomas J., her best friend, is ""allergic to everything"", and sticks with Vada despite her hangups. When Vada's father hires Shelly, and begins to fall for her, things take a turn to the worse...",1991,PG,103,"['drama', 'family', 'romance', 'comedy', 'european']",['US'],,tt0102492,6.9,80590.0,20.545,7.4,0.5
82,130,tm192769,Vegas Vacation,MOVIE,"The Griswold family hits the road again for a typically ill-fated vacation, this time to the glitzy mecca of slots and showgirls—Las Vegas.",1997,PG,94,['comedy'],['US'],,tt0120434,5.9,49377.0,12.537,6.1,0.48148148148148145
86,134,ts8570,Barney & Friends,SHOW,"Barney & Friends is an American children's television series aimed at children from ages 2 to 5. The series, which first aired on April 6, 1992, features the title character Barney, a purple anthropomorphic Tyrannosaurus rex who conveys educational messages through songs and small dance routines with a friendly, optimistic attitude.

New episodes have not been produced since 2009; however reruns continue to air on various PBS stations.",1992,TV-G,28,"['comedy', 'family']",['US'],14.0,tt0144701,3.8,9624.0,14.640999999999998,4.9,0.35714285714285715
88,136,ts27693,Kenan & Kel,SHOW,"Set in Chicago, the show follows the kid-friendly misadventures of two high-school friends who are always scheming and dreaming. Kenan, who works at a grocery store, constantly devises crazy plans to strike it rich, while orange-soda-loving buddy Kel is always dragged along for the ride despite his track record for messing things up.",1996,TV-Y7,25,"['family', 'comedy']",['US'],4.0,tt0115231,7.8,15620.0,33.544000000000004,8.3,0.16666666666666666
89,137,tm19494,The Replacements,MOVIE,"Maverick old-guard coach Jimmy McGinty is hired in the wake of a players' strike to help the Washington Sentinels advance to the playoffs. But that impossible dream hinges on whether his replacements can hunker down and do the job. So, McGinty dusts off his secret dossier of ex-players who never got a chance (or screwed up the one they were given) and knits together a bad-dream team of guys who just may give the Sentinels their title shot.",2000,PG-13,118,"['comedy', 'sport']",['US'],,tt0191397,6.6,64771.0,30.982,6.6,0.3333333333333333
92,140,tm186589,Cliffhanger,MOVIE,"A year after losing his friend in a tragic 4,000-foot fall, former ranger Gabe Walker and his partner, Hal, are called to return to the same peak to rescue a group of stranded climbers, only to learn the climbers are actually thieving hijackers who are looking for boxes full of money.",1993,R,112,"['action', 'thriller', 'comedy', 'animation']","['IT', 'US', 'FR']",,tt0106582,6.5,128972.0,27.78,6.5,0.2
95,143,tm1822,3 Ninjas Kick Back,MOVIE,"During a championship baseball match, the three brothers hear that their grandfather in Japan is in trouble, and head out to help him, conceding the match. When they arrive in Japan, they must use all their powers to defend him against his ancient enemy, who has returned to exact revenge.",1994,PG,93,"['comedy', 'family', 'action', 'sport']","['JP', 'US']",,tt0109015,4.5,9321.0,12.603,5.5,0.32653061224489793
96,144,tm55369,Edge of Seventeen,MOVIE,"From Toni Basil to the Eurythmics, from friendship bracelets to whip-it's, the summer of 1984 was about as 80s as the 80s ever got. Stuck right in the middle of it is Eric Hunter, heading towards his senior year, and passing the summer working at a local amusement park in the fast food restaurant. He is joined by his long time girl/friend Maggie, as they don their ugly brown polyester uniforms and face the world.",1998,R,104,"['romance', 'drama', 'comedy']",['US'],,tt0138414,6.8,6549.0,6.276,6.5,0.275
99,149,ts11397,Adventures of Sonic the Hedgehog,SHOW,"Follow the adventures of Sonic the Hedgehog, and his sidekick Tails, as they attempt to stop Dr. Robotnik and his array of robots from taking over the planet Mobius.",1993,TV-Y7,22,"['scifi', 'animation', 'action', 'comedy', 'family', 'fantasy', 'western']",['US'],4.0,tt0222518,6.2,3902.0,13.313,6.3,0.0
101,151,ts21581,Girlfriends,SHOW,"The series revolves around the friendship of four African-American women in different phases of their lives. They explore the many trials and tribulations that most women face today such as relationships, family, friends and other current issues that will interest most women. Whether it’s getting over a divorce, finding a career, or looking for true love, Girlfriends delivers along with comedy and wit.",2000,TV-PG,21,"['drama', 'comedy']",['US'],8.0,tt0247102,7.2,4528.0,12.163,7.7,0.4
104,154,tm191431,Double Team,MOVIE,He's a one-man arsenal... with enough voltage to rock the free world. They Don't Play by the Rules. You're either on their side...or in their way. America's top counter-terrorist usually works alone...this time he's got company.,1997,R,93,"['action', 'scifi', 'comedy', 'thriller']","['HK', 'US']",,tt0119013,4.8,34396.0,14.599,5.1,0.3181818181818182
106,156,tm49839,The Players Club,MOVIE,"Single mother Diana struggles to provide for her child and pay for her college education. When she meets two dancers from a nearby gentlemen's club, Diana's convinced there's fast money to be made stripping.",1998,R,104,"['comedy', 'drama']",['US'],,tt0119905,5.9,6676.0,9.25,6.3,0.38095238095238093
107,157,ts20918,The Parkers,SHOW,"The Parkers is an American sitcom that aired on UPN from August 30, 1999, to May 10, 2004. A spin-off of UPN's Moesha, The Parkers features the mother-daughter team of Nikki and Kim Parker. The Parkers' signature ""Heeyyy"" greeting became very popular in the early 2000s.",1999,TV-PG,19,['comedy'],['US'],5.0,tt0200353,6.8,2377.0,5.745,8.1,0.5
108,158,ts21693,"Sister, Sister",SHOW,"Twins Tia Landry and Tamera Campbell were separated and adopted at birth. Fourteen years later, they encounter each other by chance at the mall. After the families meet, Tia's widowed father agrees to let Tamera and her single mother move in with them.",1994,TV-PG,22,"['comedy', 'drama', 'family']",['US'],6.0,tt0108927,6.2,12657.0,21.489,7.5,0.4
109,159,ts20939,Moesha,SHOW,"Moesha was an American sitcom series that aired on the UPN network from January 23, 1996 to May 14, 2001. The series stars R&B singer Brandy Norwood as Moesha Mitchell, a high school student living with her family in the Leimert Park neighborhood of South Central Los Angeles. It was originally ordered as a pilot for the CBS network's 1995-1996 television season, who rejected. It was then picked up by UPN, who aired it as a mid-season replacement. It went on to become the biggest success for the nascent network and one of the greatest hits over the course of the network's entire run.",1996,TV-PG,21,"['drama', 'comedy', 'family']",['US'],6.0,tt0115275,5.8,3747.0,10.901,7.0,0.16666666666666666
112,168,tm64817,Jerry Seinfeld: I'm Telling You for the Last Time,MOVIE,"Taped for HBO in August 1998, on the final date of Jerry Seinfeld's tour appearances at New York City's Broadhurst Theater, I'm Telling You for the Last Time presents the standup comedian's so-called ""final"" standup, or at least his final tour with the standup material that made him famous.",1998,G,75,"['comedy', 'documentation']",['US'],,tt0500140,7.9,5879.0,5.822,7.6,0.2857142857142857
115,174,tm21911,Sam Kinison: Live in Vegas,MOVIE,"Comedy / Music/Musical - In the town that knows no limits, Kinison gives a completely raw and uncensored performance at the very height of his career. Filled with scorching comedy, hot women and sizzling rock 'n roll, this rarely seen live show encapsulates the energy, verve and relentless brand of comedy that was unique to Kinison.",1991,,72,"['comedy', 'music', 'documentation']",['US'],,tt0249934,6.6,276.0,0.6559999999999999,6.0,0.0
116,175,tm188970,Bill Hicks: Revelations,MOVIE,"Bill Hicks in the height of his genius. Recorded at the Dominion Theatre in London, Hicks opens our eyes and minds to the hypocrisy and ludicrousness of the world around us.",1993,,74,"['comedy', 'documentation']",['GB'],,tt0152183,8.5,3098.0,3.784,8.1,0.0
117,180,tm8687,Sam Kinison: Family Entertainment Hour,MOVIE,"Get ready to scream with laughter! Sam Kinison's primal scream will echo down through the comedy hall of fame summing up so much of modernity's horror and stupidity. This concert was taped at the Wiltern Theatre where Sam was joined with the Randy Hansen Band and a salacious slew of sinuous sirens, including his wife Malika. Join Sam Kinison and guests for a concert guaranteed to make you laugh 'til you cry for more - there's something for every member of the family - Sam Kinison style!",1991,,49,['comedy'],['US'],,,,,1.84,6.1,0.36363636363636365
118,181,tm104933,Sinbad: Son of a Preacher Man,MOVIE,"Experience veteran comedian Sinbad as he returns to his college town of Denver and performs at the Paramount Theatre for this next installment of his famed HBO Comedy Specials. Sinbad: Son of a Preacher Man is a self-styled monologue that comments on the perils of skiing, para-sailing during a bad vacation, fashion trends in lingerie, and more!",1996,,56,"['comedy', 'documentation']",['US'],,tt0938333,6.8,116.0,1.536,5.8,0.0
120,188,tm57169,Monty Python: Live at Aspen,MOVIE,"In March 1998 in Aspen, Colorado, the surviving members of the Monty Paython team - John Cleese, Terry Gilliam, Eric Idle, Terry Jones and Michael Palin - shared a stage together for the first time in 18 years. Even more remarkably, Graham Chapman was there too....in an urn! The occasion for this renuion was the US Comedy Arts Festival Tribute to Monty Python, hosted by Robert Klien in front of a live audience.",1998,,58,"['comedy', 'documentation']","['GB', 'US']",,tt0287570,7.8,1096.0,2.681,6.9,0.2
122,196,tm128073,Bill Hicks: Relentless,MOVIE,"Bill Hicks tells us how he feels about non-smokers, blow-jobs, religion, war and peace, and drugs and music.",1992,,61,['comedy'],['GB'],,,,,3.822,7.8,0.0
123,197,tm7951,Tim Allen: Rewires America,MOVIE,This is arguably Tim Allen's best stand-up show ever and this show truly solidified Tim Allen's unique slant on masculinity becoming the backbone for his TV show “Home Improvement.”,1991,PG,30,"['comedy', 'documentation']",['US'],,tt0294967,6.0,198.0,2.297,7.0,0.0
124,198,tm7135,Bill Hicks: One Night Stand,MOVIE,"Bill Hicks shows us his view on smoking, smoking pot, drinking, sex, advertisement and music. It's not a view you hear very often.",1991,NC-17,30,['comedy'],['US'],,,,,1.08,7.5,0.0
125,203,tm64729,Sinbad: Nothin' but the Funk,MOVIE,"Enjoy Comedic Superstar Sinbad as he gives us one of his most stellar stand up performances, shot on the beautiful island of Aruba at the Guillermo P. Trinidad Theatre. As always, Sinbad shows why he’s a veteran in comedy since the 80’s, with an entertaining show that the entire family can enjoy.",1998,,56,"['comedy', 'documentation']",['US'],,tt0938332,6.3,65.0,1.83,5.2,0.0
126,204,tm184224,Sinbad: Afros and Bellbottoms,MOVIE,"Sinbad brings the '70s back with a nostalgic stand-up special dedicated to the films, fashion and other flashbacks from that era.",1993,PG-13,60,"['comedy', 'documentation']",['US'],,tt0938331,7.8,172.0,3.793,5.5,0.5
